<?xml version="1.0" encoding="UTF-8"?>
<!DOCTYPE playas SYSTEM "Examen12018.dtd">
<playas>
	<playa nombre="Benalm치dena" tipoembarcacion="altamar" coloragua="azul">
		<calidadsocorrismo>Excelente
			<numerovisitantes numero="100000"/>
		</calidadsocorrismo>
		<banderaazul>
			<activa></activa>
		</banderaazul>
	</playa>
	<playa nombre="Malapesquera" tipoembarcacion="bajamar">
		<calidadsocorrismo>Buena, &calidad;
			<numerovisitantes numero="50000"/>
		</calidadsocorrismo>	
	</playa>
	<socorrista nombre="Ram칩n"/>
	<socorrista nombre="Ana"/>
	<zona zonasocorrista="Ram칩n">Oeste</zona>
	<trabajo tipotrabajo="Ram칩n Ana"/>
	<vigilante nombre="Juan Miguel" pistola="si" tipoplaca= "autorizado"/>
</playas>